{
  "$schema": "https://json-schema.org/draft/2020-12/schema",
  "$id": "https://github.com/Codys-Wright/studio-linux/blob/main/themes/schema.json",
  "title": "studio-linux theme pack",
  "description": "theme.json (the core) and manifest.json of a studio-linux theme pack. See docs/THEME-FORMAT.md.",
  "$ref": "#/$defs/theme",
  "$defs": {
    "color": {
      "description": "Opaque color, #rrggbb.",
      "type": "string",
      "pattern": "^#[0-9a-fA-F]{6}$"
    },
    "colorAlpha": {
      "description": "Color with alpha, #rrggbbaa (CSS order).",
      "type": "string",
      "pattern": "^#[0-9a-fA-F]{8}$"
    },
    "unit": { "type": "number", "minimum": 0, "maximum": 1 },
    "wallpaperItem": {
      "description": "A wallpaper: a path (relative to the pack, or absolute), or {path, video?, preview?} for a still that stands for a video.",
      "oneOf": [
        { "type": "string", "minLength": 1 },
        {
          "type": "object",
          "additionalProperties": false,
          "required": ["path"],
          "properties": {
            "path": { "type": "string", "minLength": 1, "description": "The image the shell shows (a video here is listed but flagged: the image layer can't play it)" },
            "video": { "type": "string", "description": "The video this still was taken from" },
            "preview": { "type": "string", "description": "A small thumbnail for pickers" }
          }
        }
      ]
    },
    "lockDesign": {
      "type": "object",
      "additionalProperties": false,
      "required": ["path"],
      "properties": {
        "name": { "type": "string", "pattern": "^[a-z0-9][a-z0-9._-]*$", "description": "Unique in the pack; vibes refer to it as <pack>:<name>. Default: metadata.desktop's Name, else the pack name (or the locks/<dir> name)" },
        "format": { "enum": ["studio", "qylock"], "description": "studio: Main.qml against docs/THEME-FORMAT-LOCK.md. qylock: an SDDM-API QML theme dir (metadata.desktop, theme.conf, MainScript). Default: qylock when the dir has metadata.desktop" },
        "path": { "type": "string", "description": "Directory relative to the pack (or absolute)" },
        "preview": { "type": "string", "description": "A screenshot for pickers (default: preview.* / screenshot.* in the design dir)" }
      }
    },
    "vibeRefs": {
      "description": "<pack>:<file> (wallpapers) / <pack>:<lock name> (locks), or <pack> for all of that pack's. Resolved when that pack is installed; missing ones are skipped.",
      "type": "array",
      "items": { "type": "string", "pattern": "^[a-z0-9][a-z0-9._-]*(:.+)?$" }
    },
    "theme": {
      "type": "object",
      "required": ["palette"],
      "additionalProperties": false,
      "properties": {
        "$schema": { "type": "string" },
        "name": {
          "description": "Legacy; manifest.json's name wins.",
          "type": "string"
        },
        "polarity": { "enum": ["dark", "light"], "default": "dark" },
        "palette": {
          "description": "Semantic roles every component reads. Extra #rrggbb entries pass through to consumers.",
          "type": "object",
          "required": ["bg", "surface", "overlay", "text", "subtext", "accent", "accent2", "urgent", "ok", "warn"],
          "additionalProperties": { "$ref": "#/$defs/color" },
          "properties": {
            "bg": { "$ref": "#/$defs/color", "description": "Window / desktop background" },
            "surface": { "$ref": "#/$defs/color", "description": "Raised surfaces: cards, popovers, headerbars" },
            "overlay": { "$ref": "#/$defs/color", "description": "Borders, separators, selection" },
            "text": { "$ref": "#/$defs/color" },
            "subtext": { "$ref": "#/$defs/color", "description": "Secondary text" },
            "accent": { "$ref": "#/$defs/color" },
            "accent2": { "$ref": "#/$defs/color" },
            "urgent": { "$ref": "#/$defs/color", "description": "Errors, destructive actions (ANSI red)" },
            "ok": { "$ref": "#/$defs/color", "description": "Success (ANSI green)" },
            "warn": { "$ref": "#/$defs/color", "description": "Warnings (ANSI yellow)" }
          }
        },
        "ansi": {
          "description": "Optional explicit 16 terminal colors; derived from the palette when absent.",
          "type": "array",
          "items": { "$ref": "#/$defs/color" },
          "minItems": 16,
          "maxItems": 16
        },
        "glass": {
          "type": "object",
          "additionalProperties": false,
          "properties": {
            "blur": { "type": "boolean", "default": true, "description": "Compositor blur behind glass; false turns niri blur off entirely" },
            "xray": { "type": "boolean", "default": true, "description": "Blur the wallpaper only (cheap) instead of what is really behind" },
            "tint": { "$ref": "#/$defs/color", "description": "Glass fill color (default: palette.bg)" },
            "opacity": { "$ref": "#/$defs/unit", "description": "Glass fill opacity (default 0.45 dark / 0.5 light)" },
            "border": { "$ref": "#/$defs/color", "default": "#ffffff" },
            "borderOpacity": { "$ref": "#/$defs/unit", "description": "default 0.14 dark / 0.6 light" },
            "radius": { "type": "number", "minimum": 0, "default": 14, "description": "Shell surface corner radius (px)" },
            "noise": { "type": "number", "minimum": 0, "maximum": 10, "default": 0.02 },
            "saturation": { "type": "number", "minimum": 0, "maximum": 10, "default": 1.6 },
            "terminalOpacity": { "$ref": "#/$defs/unit", "description": "Terminal background opacity (default 0.85 with blur, 1 without)" },
            "shadow": { "$ref": "#/$defs/colorAlpha", "description": "Focused window shadow (default #00000066 dark / #0000002e light); inactive windows get a fainter one" },
            "edgeDarken": { "$ref": "#/$defs/unit", "description": "Darkened inner rim of glass surfaces (default 0.35 dark / 0.18 light)" },
            "specular": { "$ref": "#/$defs/unit", "description": "Top specular highlight of glass surfaces (default 0.5 dark / 0.75 light)" }
          }
        },
        "wallpaper": {
          "type": "object",
          "additionalProperties": false,
          "properties": {
            "gradient": { "type": "array", "items": { "$ref": "#/$defs/color" }, "minItems": 1 },
            "image": { "type": "string", "description": "The default wallpaper: path relative to the pack (copied into the rendered bundle) or absolute. Default: the first still of images / wallpapers/" },
            "images": { "type": "array", "items": { "$ref": "#/$defs/wallpaperItem" }, "description": "The rest of the collection, after image; files in the pack's wallpapers/ dir follow these" }
          }
        },
        "fonts": {
          "description": "Declaring fonts makes terminals use them too.",
          "type": "object",
          "additionalProperties": false,
          "properties": {
            "ui": { "type": "string" },
            "mono": { "type": "string" },
            "size": { "type": "number", "exclusiveMinimum": 0 }
          }
        },
        "shape": {
          "description": "Corner radii (px). One radius for every window: niri windows and the shell's own.",
          "type": "object",
          "additionalProperties": false,
          "properties": {
            "windowRadius": { "type": "number", "minimum": 0, "default": 12, "description": "Every window (niri window rule + the shell's windows). Default: radii.window, else 12" },
            "panelRadius": { "type": "number", "minimum": 0, "default": 18, "description": "Shell panels, popovers and cards" },
            "controlRadius": { "type": "number", "minimum": 0, "default": 8, "description": "Buttons, fields, list rows" }
          }
        },
        "bar": {
          "description": "Menu bar.",
          "type": "object",
          "additionalProperties": false,
          "properties": {
            "adaptiveText": { "type": "boolean", "default": true, "description": "Text and icons turn light or dark with the wallpaper under the bar" },
            "background": { "type": "boolean", "default": false, "description": "Draw the glass strip behind the bar (Golden Gate: no background)" }
          }
        },
        "radii": {
          "description": "Legacy: radii.window is shape.windowRadius.",
          "type": "object",
          "additionalProperties": false,
          "properties": {
            "window": { "type": "number", "minimum": 0, "default": 12, "description": "Same as shape.windowRadius (which wins)" }
          }
        }
      }
    },
    "manifest": {
      "type": "object",
      "required": ["name", "author", "version", "license"],
      "additionalProperties": false,
      "properties": {
        "$schema": { "type": "string" },
        "name": { "type": "string", "pattern": "^[a-z0-9][a-z0-9._-]*$" },
        "author": { "type": "string" },
        "version": { "type": "string", "pattern": "^[0-9]+(\\.[0-9]+)*([-+].*)?$" },
        "license": { "type": "string", "description": "SPDX identifier, or NOASSERTION" },
        "source": { "type": "string", "description": "Where the design/palette comes from (URL)" },
        "description": { "type": "string" },
        "homepage": { "type": "string" },
        "upstream": {
          "description": "Set by importers: where the pack was converted from.",
          "type": "object",
          "additionalProperties": false,
          "required": ["importer", "url", "commit"],
          "properties": {
            "importer": { "type": "string", "description": "Importer key, e.g. cozytile, qylock" },
            "url": { "type": "string" },
            "ref": { "type": "string", "description": "The ref that was requested (HEAD = default branch)" },
            "commit": { "type": "string", "pattern": "^[0-9a-f]{7,64}$" },
            "path": { "type": "string", "description": "Theme directory inside the upstream repo" }
          }
        },
        "lock": {
          "$ref": "#/$defs/lockDesign",
          "description": "The default lock screen / greeter design (shorthand for a first entry of locks). Absent: lock/Main.qml when present, else the first of locks, else the built-in design colored by the palette."
        },
        "locks": {
          "description": "More lock designs shipped in the pack (directories under locks/ are picked up too).",
          "type": "array",
          "items": { "$ref": "#/$defs/lockDesign" }
        },
        "vibes": {
          "description": "Curated links to other packs' wallpapers and lock designs that match this pack's vibe.",
          "type": "object",
          "additionalProperties": false,
          "properties": {
            "wallpapers": { "$ref": "#/$defs/vibeRefs" },
            "locks": { "$ref": "#/$defs/vibeRefs" }
          }
        }
      }
    }
  }
}
